{
    "$schema": "./transform-schema.json",
    "id": "resolution-to-nm-per-px",
    "name": "TIFF Resolution to nm/px",
    "description": "Converts a TIFF XResolution or YResolution rational value (pixels per unit) combined with the ResolutionUnit tag into a pixel size in nanometres per pixel (nm/px) as expected by the FAMH Pixel Width/Pixel Height fields. The conversion is: nm_per_px = unit_in_nm / (resolution_in_pixels_per_unit). Important caveat: most SEM and FIB tools store calibrated pixel size in a vendor-specific TIFF tag and set ResolutionUnit=1 ('No absolute unit of measurement'), which makes this transform inapplicable. In those cases, use the vendor-specific connector instead.",
    "input": {
        "type": "rational",
        "description": "XResolution or YResolution rational string as returned by `famdo extract` (e.g. '96000/1000', meaning 96 pixels per unit). The resolution unit is provided via the 'resolution_unit' parameter.",
        "example": "96000/1000"
    },
    "output": {
        "type": "number",
        "description": "Pixel size in nm/px.",
        "example": 264.58
    },
    "parameters": [
        {
            "name": "resolution_unit",
            "type": "integer",
            "description": "Value of the TIFF ResolutionUnit tag (tag 296): 1 = No absolute unit (transform not applicable), 2 = Inch (25400000 nm/inch), 3 = Centimetre (10000000 nm/cm).",
            "required": true
        }
    ],
    "notes": "Conversion constants: 1 inch = 25,400,000 nm; 1 cm = 10,000,000 nm. For ResolutionUnit=2 (inch): nm_per_px = 25400000 / resolution_float. For ResolutionUnit=3 (cm): nm_per_px = 10000000 / resolution_float. For ResolutionUnit=1 the transform must return an error or be skipped."
}